objShortName;objFullName;msg_id;compNR;msgNR;msg_object;Message ClassID;Message ClassName;Reason;Effect;Solution;Parameter_1;Parameter_2;Parameter_3;Parameter_4;Parameter_5;Parameter_6;Parameter_7;Parameter_8;Parameter_9;Parameter_10;Parameter_11;Parameter_12;Parameter_13;Parameter_14;Parameter_15;Parameter_16
Mc;MotionControl;4000_9965;4000;9965;"%8 Drive torque exceeds limit by %1 %%, base drive: %2; value: %3, limit: %4, motion command (%5) %6, parameter %7";3;Error Minor;A violation of the specified limit has been detected.;Message occurs, but program does not stop. Possible failure of the affected drive.;Reduce Acceleration;Excess in percent;Joint name;Current value;Violated limit;Position number of the segment in the path;Segment name;Segment parameter;Main run or in look-ahead problem
Rc;RobotControl;50_1661;50;1661;The output for vacuum '%1' is not connected to an I/O endpoint %3;7;;The digital vacuum output is not connected to an I/O system endpoint.;Setting the output is not possible.;Check program and system environment.;Name of vacuum.;Program name/line number in enduser program where failure occured.
Rc;RobotControl;50_3786;50;3786;Waiting for a new tracking object has been aborted by PLC.;9;;Programed abort by PLC.;No new object has been fetched.;Check PLC program.
IoCan;IoCan;2242_4170;2242;4170;%1: Recv-Failed for Message-Id='%2';4;Warning;Receive-error for CAN-ID; ; ;configured name or hardware configuration path of the CAN-channel;Message-ID
Rc;RobotControl;50_1340;50;1340;No valid pallet definition for %1 %3;7;;--;--;--
Io;IOSystem;2220_1022;2220;1022;%1: data address range overlap (start address %2, length %3);3;Error Minor;Data address ranges of two or more endpoints overlaps.;Mapping of data of endpoint in process data not possible.;Check configuration.;Configuration path of object.;Start of data area (bit);End of data area (bit)
IoEcat;IoEtherCAT;6353_37;6353;37;%1: The topology scan of the EtherCAT segment was successful.;5;Info;The topology of the EtherCAT segment was invalid and is now valid again.;The operation of the EtherCAT segment is possible.;The topology of the EtherCAT segment must be always valid.;Configuration path or name of object
Rc;RobotControl;50_1256;50;1256;The mandatory parameter '%1' (type: %2) couldn't be written to catalog;7;;A mandatory parameter to operate the rc couldn't be written in catalog;--;Check configuration and catalog;catalogpath of the parameter;type of parameter
IoCan;IoCan;2242_366;2242;366;%1: following error. Error Code: %2;3;Error Minor;drag-offset emergency reported by CANOpen-drive DS402; ; ;configured name or hardware configuration path of the axis;errorcode of module
Rc;RobotControl;50_1850;50;1850;%1: Function cannot be executed as no working range area is available for robot '%2' %3;7;;No working range area is available for the robot;Function has not been executed;Check program;Name of affected function;Name of robot;Program name/line number in end-user program where problem occured
Tc;TeachControl;3700_42;3700;42;%1 (%2/%3): Type not defined: '%4';4;Warning;The given type is not defined.;Application can not be compiled without errors.;Application must be corrected accordingly.;Filename;Line;Column;Typename
Mc;MotionControl;4000_698;4000;698;Function <%1> called with invalid enumeration value <%2> = <%3>;4;Warning;An invalid enumeration value has been passed during a function call.;Function call is ignored.;Check the application program.;Function name;Name of invalid enumeration parameter;Value of invalid enumeration parameter
Rc;RobotControl;50_1210;50;1210;%1: Creating a dynamic failed %3;7;;call of McuCreateDynamic returned false;--;--;name of instance;programname/linenumber in enduserprogram where failure occured
Rc;RobotControl;50_1284;50;1284;%1: Jogging not possible, since not all drives have been found.;7;;It wasn't possible to get a connection with all drives.;No jogging.;Check drives and drive-configuration.;Name of robot.
IoCan;IoCan;2242_10014;2242;10014;%1: SDO (index: 0x%2 subindex: %3) aborted by server: 0x06020000 (The object does not exist in the object dictionary);3;Error Minor;SDO transfer has been aborted by SDO server (the CANOpen device).;SDO transfer failed.;Check the failed SDO transfer.;configured name or hardware configuration path of the module;SDO-Transfer index;SDO-Transfer Subindex
Hsk;Housekeeper;2208_107;2208;107;Cycletime (%1) incompatible with TickTime;4;Warning;This error is released by an internal problem in the system software ;Starting the control cannot be carry out correctly ;Inform suppliers;cycle time
Tc;TeachControl;3700_255;3700;255;%1 (%2/%3): Too much time between WAIT statements;4;Warning;"The time between two WAIT-statements exceeded the configured ""waitLimit"". ";Other routines of the same priority as the affected routine are not executed.;Check the application.;filename;line;column
Rc;RobotControl;50_1190;50;1190;Error during registration of kinematics (%1) %3;7;;wrong index or to many kinematics registered;--;--;description of failure;programname/linenumber in enduserprogram where failure occured
IoCan;IoCan;2242_6120;2242;6120;%1: Node Guarding confirmation timeout;3;Error Minor;Module didnt answer on Node-Guarding-request;End-points and PDOs set into error-status;Check node-guarding, status of device and connection;configured name or hardware configuration path of the module
Rc;RobotControl;50_1604;50;1604;Parameter error! Invalid mold cycle count given (cycle count must be greater than 0)!;7;;Parameter error! Invalid mold cycle count given!;Program execution not possible;Check parameters.
Rc;RobotControl;50_2329;50;2329;Invalid time-offset for triggers (permissible range: %1 ms) %3;8;;--;--;--
Mc;MotionControl;4000_330;4000;330;Previous job command not yet processed;4;Warning;Application error: Only a limited number of jobs can be processed per update cycle.;Further trigger jobs are ignored.;Check the application program.
IoEcat;IoEtherCAT;6353_131139;6353;131139;%1: Transition to state '%2' (AL Status Code = 0x0043 Mailbox CoE).;3;Error Minor;The EtherCAT slave has unexpectedly changed its state.;The operation of the EtherCAT segment is restricted. The operation of the affected EtherCAT slave is not possible.;Identify reason for the state transition of the slave.;Configuration path or name of object;Current State
Rc;RobotControl;50_1559;50;1559;%1: Error when resetting the NC channel (current mode/state: %2, error: %4) %3;7;;Error when resetting the NC channel.;The NC channel cannot be reset as desired.;Check system and channel status.;Name of NC channel.;Current operating mode and status of the channel.;Program name / line number in enduser program where failure occured.;Error message from the command.
Rc;RobotControl;50_2392;50;2392;Configuration of local repos for '%1' is incomplete - local repos will not be activated;8;;Local repos has not been activated for given robot due to an invalid configuration;--;check configuration;name of robot
IoCan;IoCan;2242_351;2242;351;%1: continous overcurrent. Error Code: %2;3;Error Minor;overcurrent emergency reported by CANOpen-drive DS402; ; ;configured name or hardware configuration path of the axis;errorcode of module
Rc;RobotControl;50_2759;50;2759;%2: Handling of object %1x has been cancelled.;8;;Tracking has been stopped while an object was active.;Previously handled object is reported as unsuccessful.;Check application.;ID of tracking object.;Name of robot
Tc;TeachControl;3700_113;3700;113;%1 (%2/%3): Invalid parameter;4;Warning;The given is expression is not suitable for this parameter.;Application can not be compiled without errors.;Application must be corrected accordingly.;Filename;Line;Column
Tc;TeachControl;3700_218;3700;218;%1 (%2/%3): Too many variables;3;Error Minor;The UPDATE-expression contains too many variables.;The program is interrupted.;Check the application, [TC.maxUpdateVars] could be increased if appropriate.;filename;line ;column
Io;IOSystem;2220_1015;2220;1015;%1: Endpoint '%2' already exists (%3);3;Error Minor;An endpoint with specified name already exists.;Endpoint can not be used in system.;Check configuration.;Configuration path of endpoint or configured name of object and endpoint catalog name.;Name of endpoint;Configuration path of first endpoint with same name or configured name of first object and endpoint catalog name.
Rc;RobotControl;50_1191;50;1191;Robot %1: Error during startup of the mc interpolator for set values %3;7;;--;--;--
Tc;TeachControl;3700_119;3700;119;%1 (%2/%3): Unnamed routines are not allowed in units;4;Warning;In units no unnamed routines are allowed.;Application can not be compiled without errors.;Application must be corrected accordingly.;Filename;Line;Column
Mc;MotionControl;4000_764;4000;764;Maximum torque for drive of joint %1 must be greater than zero;4;Warning;A maximum torque equal or less zero was applied to a drive.;Calculated torque model cannot be used.;Check the configuration of the torque model.;Joint name
Mc;MotionControl;4000_706;4000;706;Invalid number of joints (%1) (must be %2) in the data structure %3 for transform function %4 of robot %5;4;Warning;Error due to an internal problem in the system software.;Kinematic not available. MCU cannot be started.;Provide information to your distributor: Create a Status Report and e-mail it to your distributor.;Incorrect number of joints;Correct number of joints;Name of the data structure in the function parameters;Name of the transformation function;Name of the robot
Rc;RobotControl;50_1784;50;1784;Tracking frame of provided object (%1x) is not mapped.;7;;Tracking frame is not mapped.;Tracking is not fully functional.;Contact your system supplier in case of recurrence.;ID of tracking object.;Name of called function.
Io;IOSystem;2220_12032;2220;12032;%1: cross-link ID '%2' already exists;3;Error Minor;A cross-link (input side) with this ID has already been configured.;cross-link instance cannot be created.;Check configuration.;hardware configuration path;cross-link ID
TP3;TechnologyPLC3;56_5450;56;5450;'%1': Axis ('%2') of belt is not a modulo axis.;3;Error Minor;Axes of belts of the Infeed must be operated as modulo axes.;The Infeed is not operable.;The axis configuration must be changed.;name of the belt;name of the axis
IoEcat;IoEtherCAT;6353_67;6353;67;%1: Slave is not of type '%2';3;Error Minor;The configured EtherCAT slave type does not match with the type from the engineering data file (ENI);Operation of the object is not possible.;Adapt the configuration file (cfg) or the the engineering data file (ENI).;Configuration path or name of object;Configured slave type
RepSys;ReportSystem;6062_14;6062;14;Syntaxerror in .csv-file %1 an position %2;3;Error Minor;Syntaxerror in csv file;-;-;Filename;Position
Rc;RobotControl;50_1126;50;1126;%1: missing default settings %3;7;;default-overlap, -tool or -dynamic not configured;--;configure default settings;name of path;programname/linenumber in enduserprogram where failure occured
Mc;MotionControl;4000_274;4000;274;Asymmetrical Ramp %1 (Type %2) not supported, corrected to symmetrical Ramp;4;Warning;An asymmetrical acceleration or deceleration ramp has been programmed.;The ramp form is automatically changed to symmetrical.;Use symmetrical ramps in this version only.;Name of dynamics profile;Type of dynamics profile
IoCan;IoCan;2242_4009;2242;4009;%1: Send Message failed (MsgId:%2, Additional Info:%3);3;Error Minor;sending message failed; ; ;configured name or hardware configuration path of the CAN-channel;CAN-ID;More Information
SysDgRep;SysDiagReport;7381_23;7381;23;RAM usage is ok;5;Info; ; ; 
Mc;MotionControl;4000_485;4000;485;Previous assign/remove slave command not yet processed;4;Warning;Only a limited Number of commands can be executed in an update cycle;Commands are ingored;Check application program
Rc;RobotControl;50_1461;50;1461;Data interface '%1' not connected, no operation possible. %3;7;;TeachControl data interface was not mapped.;Program stop, because operation isn't possible.;Check IEC application and TeachControl data interface.;TeachControl data interface;Program information
Mc;MotionControl;4000_744;4000;744;Configured number of passive joints (%1) too small for this robot type (must be at least %2);3;Error Minor;Configuration error: the configured number of passive joints is too small.;Kinematic cannot be used. Motion program cannot be started.;Check the configuration data of the kinematic.;Configured number of passive joints;Minimum required number of passive joints
IoEcat;IoEtherCAT;6353_65543;6353;65543;%1: Init command '%2' failed during state transition '%3' (AL Status Code = 0x0007 Firmware update not successful. Old firmware still running).;3;Error Minor;An init command failed during a state transition of the EtherCAT slave. Error occurred during firmware update.;The operation of the EtherCAT segment is restricted. The operation of the effected EtherCAT slave is not possible.;Read user manual or contact slave manufacturer. Check the failed init command.;Configuration path or name of object;Init command;State transition
Rc;RobotControl;50_2104;50;2104;Position '%1' does not converge for robot '%2';8;;The given position can not be calculated for this robot, the calculation does not converge.;Movement is not possible.;Check and modify given position.;Name of position;Name of robot
Mc;MotionControl;4000_333;4000;333;Job %2 (ID %1) has an inappropriate plane specification;5;Info;Application or user error: For a plane job the specified plane lies parallel to the plane of motion. No exact point of intersection can be determined.;Trigger plane does not work.;Check application program or trigger data.;Job ID;Job name
IoEcat;IoEtherCAT;6353_14;6353;14;%1: Working counter of cyclic command %2 is valid again.;5;Info;All slaves processed the cyclic command as expected again.;The process data of the cyclic command is processed again.;No action is necessary.;Configuration path or name of object;Number of cyclic command
Mc;MotionControl;4000_9011;4000;9011;Matrix inverse: singular matrix;4;Warning;Internal message: Matrix is singular.;Internal error with unspecific effect.;Provide information to your distributor: Create a Status Report and e-mail it to your distributor.
RepSys;ReportSystem;6062_10;6062;10;cannot access file %1, handle %2, filepos %3;4;Warning;Cannot access the repsys storage file. The function fseek failed. Maybe the file is corrupted.;-;-;Filename;Filehandle;File position
Mc;MotionControl;4000_44;4000;44;Can't read interface: '%1.%2';3;Error Minor;Interface entry cannot be read;Interface entry is not read;Check parameters and catalog;Directory;Name of entry
Rc;RobotControl;50_2387;50;2387;Internal error in flow management - Program with flow-id %1 is missing in flow-table;8;;internal error;--;contact system-deliverer on recurrence;flow-id of program
Mc;MotionControl;4000_901;4000;901;%1.%2 Line %3: %4 Joint;5;Info;User information about dominant cartesian motion.;Drop of path velocity.;Increase wrist joint or auxiliary joint dynamics.;Project name;Program and macro name;Line number;Dominant cartesian position. or orientation movement.
Rc;RobotControl;50_1293;50;1293;PLC-application stopped!;7;;Robot interpolator was not called, resp. has not finished in time. ;Robot program stop. ;Check PLC-application.
Tc;TeachControl;3700_281;3700;281;UnloadGlobal;5;Info;Message obsolete.;-;-
PciBus;Drv_PciBus;2115_120;2115;120;Internal error: 'Wait for hardware lock semaphore' timeout of EEPROM number %1 expired (%2 msec).;3;Error Minor;timeout for waiting for hardware lock semaphore has elapsed;not available;contact supplier;number of EEPROM;timeout value
Uos;UOS;2050_1021;2050;1021;System function called in interrupt;3;Error Minor;Uos function called in interrupt context;Program halted.;Internal error.
Rc;RobotControl;50_2561;50;2561;Invalid refSys for object #%1 (queue-index: %2);8;;--;--;--
Pcb;PcbManager;2212_12;2212;12;PCB Changed (part %1): old swVersion: %2, new swVersion: %3;5;Info;Second part of generic PCB-Change message;only for information; ;[INT] message part;[STRING] old swVersion;[STRING] new swVersion
IoCan;IoCan;2242_6121;2242;6121;%1: NodeGuarding invalid answer;3;Error Minor;Node-Guarding-return invalid;End-points and PDOs set into error-status;Check monitoring-machine;configured name or hardware configuration path of the module
IoCan;IoCan;2242_10017;2242;10017;%1: SDO (index: 0x%2 subindex: %3) aborted by server: 0x06040043 (General parameter incompatibility reason);3;Error Minor;SDO transfer has been aborted by SDO server (the CANOpen device).;SDO transfer failed.;Check the failed SDO transfer.;configured name or hardware configuration path of the module;SDO-Transfer index;SDO-Transfer Subindex
Rc;RobotControl;50_2318;50;2318;Function '%1' is not implemented yet %3;8;;--;--;--
TP3;TechnologyPLC3;56_1212;56;1212;%1': invalid homing speed searching switch (%2);3;Error Minor;Execution of a homing sequence is rejected due to invalid value of parameter 'homing speed search switch'.;The homing sequence is not executed.;The parameter for the homing sequence have to be checked.;name of the axis;value of parameter
Mc;MotionControl;4000_515;4000;515;"%8 Cart. jerk exceeds limit by %1 %%, component: %2; value: %3, limit: %4, motion command (%5) %6, parameter %7";3;Error Minor;Violation of the configured limit for cartesian jerk.;Undesired vibrations may occur.;Reduce jerk.;Excess in percent;Component name;Current value;Violated limit;Position number of the segment in the path;Segment name;Segment parameter;Main run or in look-ahead problem
Mc;MotionControl;4000_9964;4000;9964;%1 needed %2 seconds at %3 (Limit is %4 seconds);4;Warning;Internal error: StoppMove/StopJoints lasted longer than the configured time limit.;Stopping maybe is erronous.;Analyse the test case.;Kind of stop: StopMove or StopJoints;Time needed for stop;Path position where the stop was triggered;Configured time limit for observation.
Mc;MotionControl;4000_455;4000;455;Command MoveToTarget: Kinematic %1 is on empty path %2;4;Warning;Application error: For the command MoveToTarget the path must not be empty.;Command is ignored.;Check the application program.;Kinematic name;Path name
IoCan;IoCan;2242_9054;2242;9054;%1: DC link over-voltage (Error register: %2);3;Error Minor;see manual of device;see manual of device;see manual of device;configured name or hardware configuration path of the group;error-register
CanMan;CanManager;6070_13;6070;13;%1, MsgId %2: Data overrun;3;Error Minor;Data-Overflow;received data get lost;"there are different possibilities to solve: lower the CAN-Bus-baud-rate to increase the time between 2 messages; check timeout between 2 send-actions; lower the processor-load of the PLC";name of canal;Message-ID with error
Rc;RobotControl;50_1320;50;1320;Timeout by waiting on IO: '%1' (%2) %3;7;;--;--;--
Mc;MotionControl;4000_820;4000;820;Sum of the %1 provided filter coefficients (%2) is unequal 1;4;Warning;The sum of all FIR-filter coefficients is unequal to 1. Amplifying FIR-filters are not allowed.;Filter will not be activated.;Check configuration of filter coefficients.;Number of configured filter coefficients;Sum of filter coefficients
TP3;TechnologyPLC3;56_5528;56;5528;'%1': Error Path '%2' ('%3', '%4');7;;A Path has an error.;The transport system switches to the Error state and a Reset command is sent to the transport sysetm;-;context;Path ID;additional information;additional information
Rc;RobotControl;50_3430;50;3430;Data interface mapped %3;9;;the data interface has been mapped;--;--;programname/linenumber in enduserprogram where failure occured
TP3;TechnologyPLC3;56_1214;56;1214;%1': invalid homing acceleration (%2);3;Error Minor;Execution of a homing sequence is rejected due to invalid value of parameter 'homing acceleration'.;The homing sequence is not executed.;The parameter for the homing sequence have to be checked.;name of the axis;value of parameter
TP3;TechnologyPLC3;56_3011;56;3011;TeachControl system project is not ready - likely due to compiling errors!;7;;TeachControl system project is not ready - likely due to compiling errors!;System is stopped.;Check TeachControl system project.
Mc;MotionControl;4000_460;4000;460;Kinematic %1 has not been registered with the MCU execution unit;4;Warning;It has been tried to use a kinematic not known to the MCU. Possibly, there is an error in the configuration data, such that the kinematic has not been created.;Kinematic is not available. Programs cannot be started.;Look at additional messages.;Kinematic name
Pma;PostMortemAnalyser;2206_5;2206;5;PmaState: AnalyseNOK. Analyse data failed;4;Warning;Restart cause;not available;not available
IoCan;IoCan;2242_9024;2242;9024;%1: LSS/LMT: No access to storage media.;3;Error Minor;slave couldnt save nodenumber permanently cause error at access;node-number not set;change slave;configured name or hardware configuration path of the module
Mc;MotionControl;4000_303;4000;303;Kinematic %1: inverse transformation only possible if forward transformation = ON;4;Warning;Configuration error: If an inverse transformation is activated, then also the forward transformation must be activated.;Kinematic is not available.;Check the configuration data. Activate forward transformation.;Kinematic name
Tc;TeachControl;3700_147;3700;147;%1 (%2/%3): String constant too long;4;Warning;The length of strings must not exceed 255 characters.;Application can not be compiled without errors.;Application must be corrected accordingly.;Filename;Line;Column
Io;IOSystem;2220_250;2220;250;%1: stopped;3;Error Minor;An error or an important event occured on specified device/bus.;-;-;Configuration path or name of object
IoEcat;IoEtherCAT;6353_17;6353;17;%1: Distributed Clocks are not supported.;3;Error Minor;Slave does not support Distributed Clock, even though it is required. Distributed Clock support of a slave is required if the EtherCAT segment branches at this slave or if this slave is configured for Distributed Clocks operation.;The operation of the EtherCAT segment is not possible.;Use slave with Distributed Clocks support or change configuration and topology respectively in a way, that no Distributed Clocks support is required anymore.;Configuration path or name of object
SLx;StartupLinux;7246_22;7246;22;"Flashstate is critical (remaining spare blocks: %1; remaining erase life time: %2; serial no: %3).";4;Warning;Flashstate is critical.;Flash will get broken soon.;Change flash.;Remaining spare blocks in percent.;Remaining erase life time in percent.;Serial number of flash.
Rc;RobotControl;50_1131;50;1131;%2: Teaching '%1' rejected because position transformation failed %3;7;;Position couldn't be transformed;Object not changed;Check application and system environment;Name of object;Name of robot;Program name/line number in end-user program where failure occured
Pcb;PcbManager;2212_3;2212;3;PCB Changed (part %1): name: %2, old swVersion: %3, new swVersion: %4, addr: %5, hwVersion: %6, hwRevision: %7, funcVar: %8;5;Info;First part of PCB-Change message;Message not used;Message not used;message part;name;old swVersion;new swVersion;addr;hwVersion;hwRevision;functionVariant
Tc;TeachControl;3700_21;3700;21;%1 (%2/%3): Unknown symbol '%4';4;Warning;Internal message.;-;-;Filename;Line;Column;Unexpected characters
Rc;RobotControl;50_2650;50;2650;Pallet '%1' is not ready for command '%2' %3;8;;The ready signal is not set.;The command can not be executed.;Check program and pallet.;Name of pallet.;Affected command.;Program name/line number in enduser program where failure occured.
Mc;MotionControl;4000_430;4000;430;Command SetPathPos has invalid path position (ID %1);3;Error Minor;Application error: The path position indicated does not exist in the database (may have been deleted already).;Robot repositioning on path does not work. Program cannot be continued.;Check the application program.;Path position ID
IoCan;IoCan;2242_9042;2242;9042;%1: node guard paket received while node guarding deactivated;4;Warning;Node guarding has been deactivated, but a node guarding packet was received;none;check your device for errors;HW-Name
Rc;RobotControl;50_1860;50;1860;Single Spot Calibration: Invalid tool selected;7;;An invalid tool has been selected for the calibration;Further steps for the single spot calibration are not possible;Select a valid tool for calibration
Io;IOSystem;2220_1014;2220;1014;%1: Invalid Endpoint Type: Identifier '%2', Type '%3';3;Error Minor;Endpoints of invalid type are used (configured).;-;-;Configuration path or name of object;Identifier of endpoint;Type of endpoint
Rc;RobotControl;50_1233;50;1233;Mainmodemanager not started, due to the fact that the digital input of the deadman button is not mapped;7;;Deadman button is not mapped;--;Check configuration and IO-signals
Rc;RobotControl;50_1551;50;1551;%1: NC channel is not in a state where the robot can be moved (state=<%2>) %3;7;;NC channel is not in a state where the robot can be moved.;Robot cannot be moved via NC kernel.;Check system state (releases, drive state, pending errors, ...).;Name of robot.;Current state of the NC channel.;Program name / line number in enduser program where failure occured.
IoEcat;IoEtherCAT;6353_65590;6353;65590;%1: Init command '%2' failed during state transition '%3' (AL Status Code = 0x0036 DC Sync0 cycle time).;3;Error Minor;An init command failed during a state transition of the EtherCAT slave. DC sync0 cycle time does not fit to the application requirements.;The operation of the EtherCAT segment is restricted. The operation of the effected EtherCAT slave is not possible.;Check the failed init command.;Configuration path or name of object;Init command;State transition
