objShortName;objFullName;msg_id;compNR;msgNR;msg_object;Message ClassID;Message ClassName;Reason;Effect;Solution;Parameter_1;Parameter_2;Parameter_3;Parameter_4;Parameter_5;Parameter_6;Parameter_7;Parameter_8;Parameter_9;Parameter_10;Parameter_11;Parameter_12;Parameter_13;Parameter_14;Parameter_15;Parameter_16
Rc;RobotControl;50_1281;50;1281;%1: Jogging with full speed enabled not possible due to a blockedspace violation (active main mode: %2) - switch to a main mode with reduced speed.;7;;As long as blockedspaces are violated, only jogging with reduced speed is permitted.;No jogging in this main mode.;Change main mode.;Name of robot.;Name of active main mode.
RpcMan;RpcManager;3001_6;3001;6;RPC-Library returned %1 from svc_run;3;Error Minor;Function svc_run() returned error code.;parts of RPCManager do not work correctly;Stop server manager and restart. If problems continues, contact vendor.;internal error number
SysDgRep;SysDiagReport;7381_20;7381;20;Error while reading RAM usage state;5;Info;cannot read state; ; 
Pcb;PcbManager;2212_20;2212;20;Device: '%1' Firmware doesn't match to reference;4;Warning;different firmware version;only for information; ;[STRING] Path and Devicename
Rc;RobotControl;50_2704;50;2704;Signal useless, because 'enable full mold open' can not be used without signal 'intermediate mold open position'. Check configuration.;8;;--;--;--
IoEcat;IoEtherCAT;6353_65536;6353;65536;%1: Init command '%2' failed during state transition '%3' (AL Status Code = 0x0000 No error).;3;Error Minor;An init command failed during a state transition of the EtherCAT slave. Slave status OK;The operation of the EtherCAT segment is restricted. The operation of the effected EtherCAT slave is not possible.;Check the failed init command.;Configuration path or name of object;Init command;State transition
Uos;UOS;2050_14;2050;14;Can't add interface '%1.%2';3;Error Minor;Interface-entry cannot be added;Interface-entry is not added;Check parameters and catalog;Catalog path;Name of entry
IoEcat;IoEtherCAT;6353_28;6353;28;%1: Node address %2 is already used.;3;Error Minor;The node address is used by at least two configured slaves.;The operation of the slave is not possible.;Correct configuration.;Configuration path or name of object;Configured node address
Rc;RobotControl;50_3452;50;3452;%1 couldn't be activated %3;9;;the robot couldn't be activated;--;--;name of robot;programname/linenumber in enduserprogram where failure occured
TP3;TechnologyPLC3;56_5511;56;5511;'%1': Connection Error ('%2');7;;The network connection to the transport system reported an error.;The connection to the transport system is being cut.;-;context;error ID
Mc;MotionControl;4000_720;4000;720;Invalid number of joints (%1);4;Warning;Internal error due to invalid number of joints.;Kinematic cannot be used. Motion program cannot be started.;Provide information to your distributor: Create a Status Report and e-mail it to your distributor.;Number of joints
Mc;MotionControl;4000_9970;4000;9970;Executing StopJoints instead of StopMove due to singularity at %3 (kinematic %2%1);5;Info;During singularity handling it is not possible to stop on the path, thus every joint is stopped separatly;It is not possible to stop on the path;Avoid singularities;Error context;Name of the kinematic;Path position
Io;IOSystem;2220_50;2220;50;%1: UOS-call '%2'('%3') failed;3;Error Minor;Internal uos call error occured.;-;-;Configuration path or name of object;Internal uos call;Argument
Mc;MotionControl;4000_727;4000;727;Invalid number of wrist joints (%1) in joint vector for RobotTransform;3;Error Minor;Internal error: A vector contains an invalid number of wrist joints.;Kinematic cannot be used. Motion program cannot be started.;Provide information to your distributor: Create a Status Report and e-mail it to your distributor.;Number of wrist joints
Rc;RobotControl;50_1555;50;1555;%1: Error while switching to operating mode <%3> (current mode/state: %2, error: %4);7;;Failed to switch operating mode.;NC channel is not in the desired operating mode.;Check system and channel status.;Name of NC channel.;Current operating mode and status of the channel.;Requested operating mode.;Error message from the command.
Mc;MotionControl;4000_7005;4000;7005;Position is singular;4;Warning;Error during manual movement: Position of robot is singular.;Robot and motion program are stopped.;Move robot out of singularity.
Mc;MotionControl;4000_696;4000;696;Number of joints (%4) in %1 of function %2 is incompatible with kinematic %3 (must be %5);3;Error Minor;Application error: the specified number of joints in a data structure of a function call is inconsistent with the number of joints of the kinematic.;The function is not executed.;Check application program or configuration.;name of the data structure with the invalid number of joints;name of the function;name of the kinematic;invalid number of joints;correct number of joints
Rc;RobotControl;50_1871;50;1871;%1: incorrect use of '%1'. Command aborted! %3;7;;Execution order is incorrect.;Program execution interrupted and prevent program continuation.;Check Macro execution order. Use DeactivateGuiding() or WaitEndPosReached().;Name of Robot;Name of affected guiding frame;Programname/linenumber in enduserprogram where failure occured
TP3;TechnologyPLC3;56_90;56;90;RunTime Exception: %1 (%2);2;Error;Watchdog or cycletime overflow occured;PLC is stopped.;-;name of the task;description of exception  
Rc;RobotControl;50_1662;50;1662;Timeout while waiting for signal feedback of vacuum #%2 from vacuum group '%1' %3;7;;The vacuum signal did not show the expected value within the tolerable time.;Setting the vacuum output failed.;Check program and system environment.;Name of vacuum group.;Number of affected vacuum.;Program name/line number in enduser program where failure occured.
Mc;MotionControl;4000_41;4000;41;Can't read uint-value '%1.%2';3;Error Minor;UInt entry cannot be read;UInt entry is not read;Check parameters and catalog;Directory;Name of entry
IoEcat;IoEtherCAT;6353_131126;6353;131126;%1: Transition to state '%2' (AL Status Code = 0x0036 DC Sync0 cycle time).;3;Error Minor;The EtherCAT slave has unexpectedly changed its state. DC sync0 cycle time does not fit to the application requirements.;The operation of the EtherCAT segment is restricted. The operation of the affected EtherCAT slave is not possible.;Identify reason for the state transition of the slave.;Configuration path or name of object;Current State
Mc;MotionControl;4000_571;4000;571;Position not reachable by kinematic %2%1 at %3;3;Error Minor;The kinematic cannot reach a given position.;Robot and motion program are stopped.;Modify path of robot in the motion program.;Error context;Kinematic name;Location
Mc;MotionControl;4000_728;4000;728;Could not identify type of Scara-robot for robot %1 with provided DH-parameters;4;Warning;The particular type of scara robot could not be identfied using the provided DH parameters.;Kinematic cannot be used. Motion program cannot be started.;Use different robot type, configure different DH parameters, or contact your distributor.;Name of the robot
Tc;TeachControl;3700_142;3700;142;%1 (%2/%3): Value out of range;4;Warning;The integer value is beyond the valid range.;Application can not be compiled without errors.;Application must be corrected accordingly.;Filename;Line;Column
Rc;RobotControl;50_2920;50;2920;%1: position is not reachable;8;;position out of work area of the robot;information;check position
Mc;MotionControl;4000_509;4000;509;"%8 Joint velocity exceeds limit by %1 %%, auxiliary joint: %2; value: %3, limit: %4, motion command (%5) %6, parameter %7";3;Error Minor;A violation of the specified limit has been detected.;Drive may fail.;Reduce the velocity in the program or raise the configured limit.;Excess in percent;Joint name;Current value;Violated limit;Position number of the segment in the path;Segment name;Segment parameter;Main run or in look-ahead problem
TP3;TechnologyPLC3;56_3005;56;3005;Unable to map to shared memory: '%1';7;;A shared memory couldn't be mapped.;The PLC is stopped.;-;name of the shared memory
Mc;MotionControl;4000_363;4000;363;Area application object %1 (ID %2) has already been applied to a kinematic;3;Error Minor;Error in application program: An area application object must not be applied to more than one kinematic.;The area cannot be applied to the kinematic.;Check the application program.;Name of area application object;ID of area application object
Rc;RobotControl;50_1200;50;1200;%1: Teaching rejected because not all drives of the robot '%2' are referenced %3;7;;Robot not referenced.;Teaching is not possible.;Run referencing routine.;name of instance;name of robot;program name/line number in enduserprogram where failure occured
Rc;RobotControl;50_1404;50;1404;Reference system '%1' has implausible values;7;;Reference system has been initialised with invalid values.;Reference system cannot be used.;Modify values.;Name of reference system
Rc;RobotControl;50_1227;50;1227;%1: Referencesystem couldn't be created because all %2 systems are already used %3;7;;Can't add reference system;--;delete reference system;name of reference system;number of reference systems;programname/linenumber in enduserprogram where failure occured
IoEcat;IoEtherCAT;6353_131168;6353;131168;%1: Transition to state '%2' (AL Status Code = 0x0060 Slave restarted locally).;3;Error Minor;The EtherCAT slave has unexpectedly changed its state.;The operation of the EtherCAT segment is restricted. The operation of the affected EtherCAT slave is not possible.;Identify reason for the state transition of the slave.;Configuration path or name of object;Current State
Io;IOSystem;2220_12000;2220;12000;%1: No Axes configured;5;Info;No axes are configured on a axis-group.;-;-;Hardware configuration path of object
SysDgRep;SysDiagReport;7381_19;7381;19;Disk usage is ok;5;Info; ; ; 
IoEcat;IoEtherCAT;6353_40;6353;40;%1: The size of the hot connect group at position %2 with station alias %3 is invalid (act = %4, exp = %5).;3;Error Minor;The size of the hot connect group is different to the configured size.;The operation of the EtherCAT segment is not possible.;Change size of hot connect group or adapt configuration;Configuration path or name of object;Position of hot connect group (starting at 1);Station alias of hot connect group;Actual size;Expected size
TP3;TechnologyPLC3;56_1113;56;1113;'%1': Maximum position (%4) of a finite axis exceeded. Consider usage of a modulo axis. (%2, %3);6;Error Appl;Due to limited resolution of LREAL, the maximum position of a finite axis is limited.;The axis is in Errorstop.;Restart your application and consider usage of axis as a modulo axis.;name of the axis;PLCopen state of the axis;set position;maximum position of a finite axis
Io;IOSystem;2220_12049;2220;12049;%1: Endpoint reactivated;5;Info;A previously inactive endpoint has been reactivated;The endpoint is usable again, the endpoint error state is reset to 0;-;Configuration path or name of endpoint
Rc;RobotControl;50_1010;50;1010;Control Authority not granted to handterminal '%2' (IP: %1) since no handterminal is configured.;7;;Control Authority was requested for a handterminal while no handterminal is present in PLC configuration.;Handterminal can't be used to move robot.;Add a handterminal to PLC configuration.;IP-address of connected handterminal.;Type of connected handterminal.
Tc;TeachControl;3700_58;3700;58;%1 (%2/%3): Non-private definition uses private type;4;Warning;Non-private variables must not be defined with private types.;Application can not be compiled without errors.;Application must be corrected accordingly.;Filename;Line;Column
SLx;StartupLinux;7246_3;7246;3;Not all mandatory Entries configured - check general.cfg;2;Error;mandatory entries missing;System stops at State Init;configure mandatory entries or start setup
Rc;RobotControl;50_1790;50;1790;%1: Tracking is not possible because direct calls into the PLC program are not available!;7;;Direct calls into the PLC program are not possible because the required function is not available.;Tracking is not possible.;Check system.;Full instance path of affected variable.
Pcb;PcbManager;2212_18;2212;18;PCB Remove (part %1): funcVar: %2;5;Info;Third part of PCB-Remove message;only for information; ;[INT] message part;[STRING] functionVariant
Mc;MotionControl;4000_631;4000;631;Kinematic %1: Invalid number of master joints (%2) for passive (or virtual) joint %3.;3;Error Minor;The number of master joints for a passive (or virtual) joint is invalid.;The kinematic is not available.;Check configuration.;Name of robot;Number of master joints;Number of passive (or virtual) joint 
Rc;RobotControl;50_2587;50;2587;%1: Invalid program number = %2 selected, action '%3';8;;An invalid program number was requested.;Action cannot be executed.;Select valid program number.;Name of interface instance.;Requested program number.;Failed action, e.g. prog start.
Mc;MotionControl;4000_167;4000;167;Incompatible orientation interpolation type %1 in spline command %2 (ID %3).;3;Error Minor;An incompatible orientation interpolation type has been used in a spline command. A spline consists of several single spline commands whose type of orientation interpolation must not change.;The spline cannot be appended to the path.;You can either refrain from changing the orientation interpolation type or start a new spline.;Incompatible orientation interpolation type;Name of spline command;ID of spline command
Rc;RobotControl;50_1280;50;1280;%1: Jogging with full speed enabled not possible due to a workspace violation (active main mode: %2) - switch to a main mode with reduced speed.;7;;As long as workspaces are violated, only jogging with reduced speed is permitted.;No jogging in this main mode.;Change main mode.;Name of robot.;Name of active main mode.
Rc;RobotControl;50_2480;50;2480;%1: SetPC in backward step mode is not permitted. The system switches to interpreter step mode.;8;;SetPC in backward step mode is not permitted. ;The system switches to interpreter step mode.;Do not use SetPC in backward step mode.;Name of robot.
Mc;MotionControl;4000_772;4000;772;Cannot calculate all reaction forces of joint %1 (max. %2 allowed).;4;Warning;Too many reaction forces have been configured;The kinematic cannot be created;Reduce number of reaction forces;Joint number;maximum number of reaction forces
Rc;RobotControl;50_1651;50;1651;The output for gripper '%1' is not connected to an I/O endpoint %3;7;;The digital gripper output is not connected to an I/O system endpoint.;Setting the output is not possible.;Check program and system environment.;Name of gripper.;Program name/line number in enduser program where failure occured.
Mc;MotionControl;4000_130;4000;130;Exceeding number of auxiliary joints %3 (max. %4) in position %1 (ID %2).;3;Error Minor;Error in application program. Too many auxiliary joints for the specified kinematic.;Robot and motion program are stopped.;Check the application program.;Position name;Position ID;Number of auxiliary joints;Maximum number of auxiliary joints
TP3;TechnologyPLC3;56_1103;56;1103;%1: Drive entered state 'Not Ready To Switch On';5;Info;The drive of the axis has entered the state  'Not Ready To Switch On';-;-;name of the axis  
Tc;TeachControl;3700_219;3700;219;%1 (%2/%3): THIS is not yet defined;3;Error Minor;The keyword THIS  can not be used because the UPDATE-expression is not yet defined.;The program is interrupted.;Application must be corrected accordingly.;Filename;Line;Column
Cfg;CfgAnalyser;4700_30;4700;30;%1(%2,%3): Catalog entry '%4' doesn't exist;3;Error Minor;The configured catalog entry could not be read.;Configured file is not included.;Check configuration.;Filename;Line;Column;Name of catalog entry
Mc;MotionControl;4000_540;4000;540;Deviation (%4) of tracking delta geometry of joint %3 of kinematic %1 exceeds configured maximal deviation (%5) at %2.;3;Error Minor;During tracking the geometric deviation between predicted and actual cartesian geometry exceeds the allowed maximal deviation. Probably the tracking signal is of low quality or the configured maximal deviation is too small or there is an error in the controller software.;Robot and motion program are stopped.;Check conveyor signal or increase configured maximal deviation or contact your vendor.;Kinematic name;Motion command name;Joint name;Deviation of tracking delta geometry of the corresponding joint;Configured maximal deviation
Mc;MotionControl;4000_850;4000;850;unequal amount of area jobs (executed: %1, starep: %2);3;Error Minor;Internal message (only for testing).;None;None;Number of executed area jobs;Number of imported area jobs
Rc;RobotControl;50_1441;50;1441;%1 could not be registered;7;;Areagroup could not be registered.;Areagroup has not been created.;Check application.
Tc;TeachControl;3700_71;3700;71;%1 (%2/%3): Name not defined: '%4';4;Warning;The given identifier is not defined.;Application can not be compiled without errors.;Application must be corrected accordingly.;Filename;Line;Column;Name of the identifier.
Io;IOSystem;2220_12019;2220;12019;%1: Value '%2' for configuration entry '%3' is no multiple of '%4'. Default value '%5' will be used.;4;Warning;An invalid value has been configured for an configuration entry.;The default value will be used instead of the configured value.;To prevent this message a valid value has to be configured for this configuration entry.;configuration path or name of the device;the invalid value configured for the configuration entry;name of configuration entry;step size defined for configuration entry;default value for configuration entry
Rc;RobotControl;50_2419;50;2419;%1: Operate-with-machine key ignored in automatic mode;8;;Automatic mode is active;Pressing the key had no effect;Switch to manual mode;Name of affected robot
Mc;MotionControl;4000_420;4000;420;Kinematic %1 (joint %2): Drive has lost reference.;3;Error Minor;A drive of the kinematic lost its reference.;If the joint ist not masked, the kinematic is stopped automatically.;The drive and the joint must be referenced again.;Kinematic name;Joint name
Rc;RobotControl;50_2671;50;2671;Observation '%2' for vacuum '%1' is not available.;8;;Vacuum observation is not available.;The vacuum is not observed.;Check program.;Name of vacuum.;Name of vacuum observer.
Hsk;Housekeeper;2208_108;2208;108;Taskconfiguration for task %1 already changed.;4;Warning;Duplicate configuration;First configuration used;Change configuration;Taskname
Rc;RobotControl;50_1202;50;1202;Referencesystem (%1) invalid %3;7;;invalid reference system;--;--;enum-id of invalid reference system;programname/linenumber in enduserprogram where failure occured
Rc;RobotControl;50_1499;50;1499;%1: Watchdog Timeout occured!;7;;--;--;--
Rc;RobotControl;50_1245;50;1245;Calculating %1(%2) impossible - invalid value %3;7;;Can't calculate function;--;use different values;function;argument;programname/linenumber in enduserprogram where failure occured
IoCan;IoCan;2242_10009;2242;10009;%1: SDO (index: 0x%2 subindex: %3) aborted by server: 0x06010002 (Attempt to write a read only object);3;Error Minor;SDO transfer has been aborted by SDO server (the CANOpen device).;SDO transfer failed.;Check the failed SDO transfer.;configured name or hardware configuration path of the module;SDO-Transfer index;SDO-Transfer Subindex
Rc;RobotControl;50_2377;50;2377;Initialization of deadtime-filter '%1' failed - Rc does not manage drive update for '%2';8;;Deadtime-filter could not been initialized;--;Modify configuration, so that Rc manages drive update;name of filter;name of robot
Io;IOSystem;2220_1;2220;1;%1: configuration entry '%2' not found;3;Error Minor;An not-optional configuration entry is missing. ;The value of an internal variable couldn't be set. In most cases operation of that component is not possible.;Configuration files must be checked.;Hardware configuration path of object;Configuration entry
TP3;TechnologyPLC3;56_5350;56;5350;'%1': (%2, %3, %4);7;;The strategy module of the Infeed reported an error.;-;-;name of the Infeed;detailed information;detailed information;detailed information
IoEcat;IoEtherCAT;6353_22;6353;22;%1: Transition to state '%2' (AL Status Code = %3).;3;Error Minor;The EtherCAT slave has unexpectedly changed its state.;The operation of the EtherCAT segment is restricted. The operation of the affected EtherCAT slave is not possible.;Identify reason for the state transition of the slave.;Configuration path or name of object;Current State;AL Status Code
IoBoard;IoBoard;7259_17;7259;17;%1: Overvoltage of booster group %2 cleared.;5;Info;Booster voltage is in valid range.;not available;not available;Configurationpath or name of object;Booster group number
Tc;TeachControl;3700_55;3700;55;%1 (%2/%3): Enumeration constant already used;4;Warning;A constant with the same value has already been defined for this enumeration type.;Application can not be compiled without errors.;Application must be corrected accordingly.;Filename;Line;Column
Rc;RobotControl;50_1431;50;1431;Parallelprogram '%1' could not be stopped - a program named '%1' does not exist %3;7;;--;--;--
Mc;MotionControl;4000_9915;4000;9915;UnLock on non-existing data base object;3;Error Minor;Error due to an internal problem in the system software.;Context sensitive. Look at additional messages.;Provide information to your distributor: Create a Status Report and e-mail it to your distributor.
IoEcat;IoEtherCAT;6353_65560;6353;65560;%1: Init command '%2' failed during state transition '%3' (AL Status Code = 0x0018 No valid inputs available).;3;Error Minor;An init command failed during a state transition of the EtherCAT slave. The slave application cannot provide valid inputs.;The operation of the EtherCAT segment is restricted. The operation of the effected EtherCAT slave is not possible.;Check hardware- and software configuration of the slave. Check the failed init command.;Configuration path or name of object;Init command;State transition
Mc;MotionControl;4000_135;4000;135;Joint position %1 is applied to invalid kinematic.;4;Warning;Error in application program.;Robot and motion program are stopped.;Check the application program.;ID of joint position
Rc;RobotControl;50_3483;50;3483;Dc voltage on drive %1 to low, actual Voltage %2 Volt, necessary are %3 Volt;9;;the attached dc voltage is too low;--;check power supply;name of drive;actual dc voltage;minimum voltage
Rc;RobotControl;50_1221;50;1221;Referencing drive %1 failed %3;7;;an error occured while referencing drive;--;--;name of drive;programname/linenumber in enduserprogram where failure occured
Rc;RobotControl;50_1273;50;1273;%1: Jogging not possible due to an active e-stop (active main mode: %2).;7;;Safety release was not granted to the robot.;No jogging.;Check e-stop.;Name of robot.;Name of active main mode.
Mc;MotionControl;4000_821;4000;821;Invalid filter coefficient %1=%2;4;Warning;Invalid filter coefficients were configured.;Filter will not be activated.;Check configuration of filter coefficients.;Filter coefficient name;Filter coefficient value
Tc;TeachControl;3700_1;3700;1;%1 (%2/%3): Error limit exceeded;4;Warning;The error output was stopped after 20 compiler-errormessages.;-;-;Filename;Line;Column
Rc;RobotControl;50_1452;50;1452;No base system for pallet: '%1'!;7;;--;--;--
IoEcat;IoEtherCAT;6353_27;6353;27;%1: Too many cycles in one period (act = %2, max = %3).;3;Error Minor;"The cyclic commands are sent with too many different or too different cycle times. Too different are; e.g., 1ms, 3ms, 7ms and 10ms (relatively prim).";The operation of the EtherCAT segment is not possible.;Reduce the number of different cycle times or harmonise the cycle times of the cyclic commands.;Configuration path or name of object;Actual number of cycles;Maximum number of cycles
Rc;RobotControl;50_1298;50;1298;%1: Program execution not possible due to a not pressed enabling switch (active main mode: %2).;7;;Safety release was not granted to the robot.;Program execution is not possible.;Check enabling switch.;Name of robot.;Name of active main mode.
Mc;MotionControl;4000_317;4000;317;No wrist-inverse transformation available for kinematic %1 (ID %2);4;Warning;Configuration error: For the execution of certain commands the wrist-inverse transformation of a kinematic must be activated.;Robot can only be moved PointToPoint.;Check configuration data.;Kinematic name;Kinematic ID
Rc;RobotControl;50_2904;50;2904;%1: Error during homing - quickstop failed %3;8;;--;--;--
Mc;MotionControl;4000_903;4000;903;%1.%2 Line %3%4: Geometry-Limiter - %5%% of prog. velocity (SegNr %6);5;Info;User information about the geometry limiter.;Drop of path velocity.;Avoid sharp corners in the path.;Project name;Program and macro name;Line number;Overlap area (yes/no);Ratio of reduced velocity to pragrammed maximum velocity;Segment number
Mc;MotionControl;4000_32;4000;32;%1: Read from file error: '%2' (%3);3;Error Minor;An error occurred while reading from a file.;not available;not available;Detailed information about where the error occurred;File name;Detailed information
IoCan;IoCan;2242_10019;2242;10019;%1: SDO (index: 0x%2 subindex: %3) aborted by server: 0x06060000 (Access failed due to an hardware error);3;Error Minor;SDO transfer has been aborted by SDO server (the CANOpen device).;SDO transfer failed.;Check the failed SDO transfer.;configured name or hardware configuration path of the module;SDO-Transfer index;SDO-Transfer Subindex
