objShortName;objFullName;msg_id;compNR;msgNR;msg_object;Message ClassID;Message ClassName;Reason;Effect;Solution;Parameter_1;Parameter_2;Parameter_3;Parameter_4;Parameter_5;Parameter_6;Parameter_7;Parameter_8;Parameter_9;Parameter_10;Parameter_11;Parameter_12;Parameter_13;Parameter_14;Parameter_15;Parameter_16
Mc;MotionControl;4000_731;4000;731;Could not identify type of SemiScara-robot for robot %1 with provided DH-parameters;4;Warning;The particular type of semi-scara robot could not be identfied using the provided DH parameters.;Kinematic cannot be used. Motion program cannot be started.;Use different robot type, configure different DH parameters, or contact your distributor.;Name of the robot
Rc;RobotControl;50_3520;50;3520;%1: Border of joints area '%2' reached with joint '%3';9;;A border of a joints area has been reached during jogging.;The given joint cannot move any further in the current direction.;Change movement direction or check joints areas.;Name of robot;Name of joints area;Name of joint
Rc;RobotControl;50_2902;50;2902;%1: Error during homing - switching to operating mode 'homing' failed %3;8;;--;--;--
Rc;RobotControl;50_1473;50;1473;RcACFInterface <%1> is not activated;7;;Interface at PLC is not activated;Usage impossible;Activate interface at PLC;Interface number
Rc;RobotControl;50_2588;50;2588;%1: FTL program '%2' from project '%3' not available, action '%4';8;;Requested program is not available.;Action cannot be executed.;Check program table.;Name of interface instance;Name of requested FTL program.;Name of requested FTL project.;Failed action, e.g. prog start.
Mc;MotionControl;4000_686;4000;686;Cannot delete motion buffer from ExecUnit-List (doesn't exist);4;Warning;Error due to an internal problem in the system software.;Unspecific effect.;Provide information to your distributor: Create a Status Report and e-mail it to your distributor.
Mc;MotionControl;4000_344;4000;344;Distance job %1 cannot be applied to Kinematic %2;3;Error Minor;Application error: ist is not allow to apply a distance job to a kinematic. They can only be used with motion commands.;Distance job is rejected.;Check the application program;Job name;Name of kinematic
IoEcat;IoEtherCAT;6353_131089;6353;131089;%1: Transition to state '%2' (AL Status Code = 0x0011 Invalid requested state change).;3;Error Minor;The EtherCAT slave has unexpectedly changed its state. Requested state change is invalid.;The operation of the EtherCAT segment is restricted. The operation of the affected EtherCAT slave is not possible.;Go step-by-step from the original state to the desired state. Identify reason for the state transition of the slave.;Configuration path or name of object;Current State
IoCan;IoCan;2242_10031;2242;10031;%1: SDO (index: 0x%2 subindex: %3) aborted by server: 0x08000021 (Data cannot be transferred or stored to the application because of local control);3;Error Minor;SDO transfer has been aborted by SDO server (the CANOpen device).;SDO transfer failed.;Check the failed SDO transfer.;configured name or hardware configuration path of the module;SDO-Transfer index;SDO-Transfer Subindex
Rc;RobotControl;50_1104;50;1104;Drive %1: limit switch reached (%2) %3;7;;limit switch reached;--;--;name of drive;'Min' or 'Max';programname/linenumber in enduserprogram where failure occured
Rc;RobotControl;50_1232;50;1232;%1: McuCreateOverlap failed %3;7;;creating an overlap-object failed in MCU;--;--;name of the routine which has set the message;programname/linenumber in enduserprogram where failure occured
Rc;RobotControl;50_1301;50;1301;%1: Program execution not possible due to a workspace violation.;7;;Robot has left workspace.;Program execution not possible.;Check workspaces and robot position.;Name of robot.
Rc;RobotControl;50_2541;50;2541;%1: Overlap values corrected (%2) %3;8;;--;--;--
Io;IOSystem;2220_12026;2220;12026;%1: '%2' value conversion exceeds range (value: %3, factor: %4).;3;Error Minor;"A value conversion (e.g; set value) from user units (endpoint value) to device units has exceeded the range, with the used conversion factor (e.g; for drives posUnitsToIncrement).";Set value is not used (also no limit), changing to error state (if possible).;Check conversion factor and set value.;Configured name or path of device (drive);"Description of the value, e.g; set position, set velocity, ...";Value (of endpoint), which has caused range error;"Used conversion factor (e.g; from configuration)"
Rc;RobotControl;50_1712;50;1712;%4: Failed to save robot position '%1' at signal event of '%2' %3;7;;Position could not be read or saved.;The signal position is not stored in the position variable.;Check program and position variable.;Name of position;Name of macro;Program name/line number in end-user program where failure occured;Affected robot
Rc;RobotControl;50_1990;50;1990;Function '%1' has been called from system flow (%2);7;;The given function cannot be used in system flows.;Execution of the function failed.;Check application;Name of function not allowed in system flows;Source position of call from system flow
Rc;RobotControl;50_1289;50;1289;%1: Jogging is not permitted in main mode '%2';7;;Jog release was not granted to the robot.;Jogging is not possible.;Change main mode or check releases.;Name of robot.;Name of active main mode.
Rc;RobotControl;50_1505;50;1505;Can not use Euromap, because for not 3D-able Robots the signal: zone switch feedback 'mold area free' is necessary!;7;;--;--;--
Mc;MotionControl;4000_655;4000;655;Invalid frame type: %1;4;Warning;Application error: When specifying a frame an invalid frame type has been used.;Invalid reference system or tool definition.;Check the application program.;Frame type
Io;IOSystem;2220_12011;2220;12011;%1: Invalid reference value.;3;Error Minor;The reference sensor value is not plausible.;no change;not available;Configurationpath or name of object
IoEcat;IoEtherCAT;6353_73;6353;73;%1: Timing violation occurred (%2).;4;Warning;A timing violation occurred for the first time.;The projected frames can not be transferred with the calculated timing.;"According to the error cause the folllowing configuration entries must be increased: 'DMA': dmaTime; 'SW normal': startOffset; 'SW early': earlyStartOffset. For an optimum configuration please read the relevant chapter in the system manual.";Configuration path or name of object;Error cause (possible values: 'DMA', 'SW normal', 'SW early')
IoEcat;IoEtherCAT;6353_75;6353;75;%1: Configured FoE file transfer failed (file '%2', state %3, AL Status code 0x%4, error code 0x%5).;3;Error Minor;The configured file transfer via FoE failed.;The file was not transferred to the slave.;Correct file content or file name. Execute slave specific resolution depending on error code.;Configuration path or name of object;Name of file to transfer (without path);State (possible values: 0 .. Error when reading AL status code, 1 .. Timeout when polling AL status code, 2 .. FoE transfer error, 3 .. starvation timeout);AL status code;Error code (see documentation of slave, 0xFFFFFFFF if not available)
KCmpL2R;CmpKLog2RepSys_V3;7512_5;7512;5;Exit application %1;5;Info;-;-;-;Applicationname
SysDgRep;SysDiagReport;7381_21;7381;21;RAM usage over 90%%;5;Info; ;There is the possibility of the OOM Killer, if more applications are executed.; 
Tc;TeachControl;3700_261;3700;261;The Interpreter violated the subsequent cycle;4;Warning;Inadequate configuration;Unexpected data inconsistency possible;Increase configuration parameter idleLimit
Mc;MotionControl;4000_784;4000;784;Configured number of passive base joints (%1) too small for this robot type (must be at least %2);3;Error Minor;Configuration error: the configured number of passive base joints is too small.;Kinematic cannot be used. Motion program cannot be started.;Check the configuration data of the kinematic.;Configured number of passive base joints;At least required number of passive base joints
Mc;MotionControl;4000_425;4000;425;Kinematic %1 (Joint %2): Drive repositioning not possible. Kinematic is not ready.;4;Warning;Repositioning of a drive is not possible as the kinematic is not in state 'ready'.;Repositioning of the drive has not been done.;Start the repositioning of a drive only when the kinematic is in state 'ready'.;Kinematic name;Joint name
IoCan;IoCan;2242_6141;2242;6141;%1: Operation ('%2') on PDO not possible (%3);3;Error Minor;PDO ran in invalid mode; ; ;configured name or hardware configuration path of PDO;Action planned on the PDO;Operating-mode of PDO
CatRet;CatalogRetain;2218_107;2218;107;type %3 of UOS Catalogentry %1 (handle=%2) is not supported yet;3;Error Minor;unknown UOS catalog type;-;-;catalog node name;catalog node handle;catalog node type
Mc;MotionControl;4000_705;4000;705;DH-Parameters not initialized in transform function %1 of robot %2;4;Warning;Error due to an internal problem in the system software.;Kinematic not available. MCU cannot be started.;Provide information to your distributor: Create a Status Report and e-mail it to your distributor.;Name of the transformation function;Name of the robot
IoEcat;IoEtherCAT;6353_65581;6353;65581;%1: Init command '%2' failed during state transition '%3' (AL Status Code = 0x002D No sync error).;3;Error Minor;An init command failed during a state transition of the EtherCAT slave. Sync signal not received.;The operation of the EtherCAT segment is restricted. The operation of the effected EtherCAT slave is not possible.;Check the failed init command.;Configuration path or name of object;Init command;State transition
Mc;MotionControl;4000_400;4000;400;Wrong joint number %1 in servo module of kinematic %2 during action %3;4;Warning;Configuration error: The operation indicated could not be performed on the requested joint.;The operation indicated could not be performed on the specified joint.;Check the joint number in the configuration.;Joint number;Kinematic name;Additional information
Mc;MotionControl;4000_55;4000;55;Object with ID <%1> is not of type <%2> (%3);4;Warning;The application program called a function with an invalid object ID as a parameter (wrong kind of object).;Function call has no effect.;Check the application program.;Invalid object ID;Expected object type;Additional information
Rc;RobotControl;50_1447;50;1447;More than one robots got permission to enter shared area '%1'!;7;;Enter permission has been granted to several robots. This has been detected by the internal observation for shared areas.;Robot programs are stopped.;Contact your system integrator.;Name of area.
Rc;RobotControl;50_1450;50;1450;Pallet: '%1' is full, can not load a next part!;7;;--;--;--
CanMan;CanManager;6070_12;6070;12;%1: Receive Fifo overflow;3;Error Minor;Overflow of Receive FIFO; ; ;name of canal
Tc;TeachControl;3700_116;3700;116;%1 (%2/%3): No eventroutine;4;Warning;The given routine is no eventroutine.;Application can not be compiled without errors.;Application must be corrected accordingly.;Filename;Line;Column
Rc;RobotControl;50_1811;50;1811;%1: Error during plotter initialisation %3;7;;Mc-plotter for this robot could not be initialised;text segments can not be executed;check system;name of robot;programname/linenumber in enduserprogram where failure occured
Rc;RobotControl;50_1791;50;1791;Direct call of PLC function failed. (Instance: %1, FunctionNr.: %2);7;;Internal Error: Direct call into plc failed because either function nr not registered, or unexpected parameter size given. ;Direct call into PLC rejected.;Contact manufacturer. 
IoCan;IoCan;2242_10002;2242;10002;%1: SDO (index: 0x%2 subindex: %3) aborted by server: 0x05040001 (Client/server command specifier not valid or unknown);3;Error Minor;SDO transfer has been aborted by SDO server (the CANOpen device).;SDO transfer failed.;Check the failed SDO transfer.;configured name or hardware configuration path of the module;SDO-Transfer index;SDO-Transfer Subindex
IoCan;IoCan;2242_10027;2242;10027;%1: SDO (index: 0x%2 subindex: %3) aborted by server: 0x06090033 (Configured module list does not match detected module list);3;Error Minor;SDO transfer has been aborted by SDO server (the CANOpen device).;SDO transfer failed.;Check the failed SDO transfer.;configured name or hardware configuration path of the module;SDO-Transfer index;SDO-Transfer Subindex
STA;Statusreport;2211_3;2211;3;Statusreport Zip-Archive creation failed;3;Error Minor;Statusreport Zip-Archive creation failed;Can not create statusreport;inform  supplier
Rc;RobotControl;50_3453;50;3453;%1: unable to start the drives - power not applied %3;9;;drives couldn't be started, because power is not supplied;--;apply power to drives;name of robot;programname/linenumber in enduserprogram where failure occured
Mc;MotionControl;4000_712;4000;712;Invalid number of joints (%1);4;Warning;Invalid number of joints;Kinematic cannot be used. Motion program cannot be started.;Provide information to your distributor: Create a Status Report and e-mail it to your distributor.;Number of joints
Mc;MotionControl;4000_262;4000;262;Invalid deceleration profile in dynamics %1 (ID %2);4;Warning;Application error: A dynamics object has been assigned an invalid deceleration profile.;The dynamics settings are not changed.;Look for previous errors concerning ramp or profile parameters.;Dynamics name;Dynamics ID
IoDrvCpl;IoDriveCoupler;7622_2;7622;2;%1: MAC address ignored in EoE parameter.;4;Warning;MAC address in EoE init command.;MAC address of EoE init command is not applied on slave device, it is ignored.;If necessary change EoE parameter in EtherCAT master configuration.;Configuration path or name of object
Io;IOSystem;2220_2;2220;2;%1: configuration entry '%2' out of range, default %3;3;Error Minor;The value of a configuration entry is outside the valid range.;A default value is used.;Configuration files must be checked.;Hardware configuration path of object;Configuration entry;Default value
Mc;MotionControl;4000_804;4000;804;TrackingLogger status: samples: %1, overflow: %2, Trsf: %3;5;Info;State information of tracking logger;None;None;Number of samples;Overflow occurred?;Tracking reference system name
Mc;MotionControl;4000_9908;4000;9908;Internal message: file %1, line %2;5;Info;Error due to an internal problem in the system software.;Context sensitive. Look at additional messages.;Provide information to your distributor: Create a Status Report and e-mail it to your distributor.;Module name where the message occurred;Line number in module
Rc;RobotControl;50_2570;50;2570;%1: message buffer overflow - not all messages will be sent correctly;8;;--;--;--
Rc;RobotControl;50_1406;50;1406;Variable tool '%1' couldn't be created due to a cyclic dependancy %3;7;;Given variable tool couldn't be created due to a cyclic dependancy.;Tool can not be used.;Check tool data.;Name of tool.;Program name / line number in enduser program where failure occured.
Mc;MotionControl;4000_428;4000;428;Kinematic %1 (drive %2): Servo following error %3 exceeded limit (%4).;5;Info;The following error of a drive exceeded the configured limit.;The robot is stopped;Solve problem in drive control or path generation;Name of Kinematic;Name of Drive;current following error;following error limit
Rc;RobotControl;50_2670;50;2670;Observation '%2' for vacuum group '%1' is not available.;8;;Vacuum observation is not available.;The vacuum group is not observed.;Check program.;Name of vacuum group.;Name of vacuum observer.
Pcb;PcbManager;2212_7;2212;7;PCB Add (part %1): name: %2, swVersion: %3, addr: %4;5;Info;First part of generic PCB-Add message;only for information; ;[INT] message part;[STRING] name;[STRING] swVersion;[UINT] address
Rc;RobotControl;50_1141;50;1141;Robot %1: drive already connected in ApplyDrive %3;7;;tried to connect an already connected drive a second time;--;--;name of robot;programname/linenumber in enduserprogram where failure occured
Rc;RobotControl;50_1179;50;1179;Macro '%2' not permissible, since drives for '%1' have not been released yet %3;7;;--;--;--
Tc;TeachControl;3700_211;3700;211;%1 (%2/%3): No Parameter;3;Error Minor;An optional parameter was accessed which is not available.;The program is interrupted.;Application must be corrected accordingly.;Filename;Line;Column
Rc;RobotControl;50_1342;50;1342;GetPosition failed for %1 %3;7;;--;--;--
Mc;MotionControl;4000_614;4000;614;Configured lookAheadTime (%1s) exceeds max. lookAheadTime (%2s);3;Error Minor;Configuration error: The configured look-ahead time exceeds the maximum look-ahead time.;The configured look-ahead time will be ignored.;Check configuration for lookAheadTime and preTriggerTime.;Configured look-ahead time;Maximum look-ahead time
IoBoard;IoBoard;7259_1;7259;1;%1: Component is already initialised.;5;Info;Die Komponente wurde bereits initialisiert.;not available;not available;component shortname
Mc;MotionControl;4000_673;4000;673;Cannot copy MCU Status Report file from %1 to %2;4;Warning;Occurs when a Status Report is written and the mass storage medium is full or an internal error occurs.;Status report file cannot be written. No diagnostic information available.;If harddisk is full, delete some files, otherwise inform your distributor.;Source directory and file name;Target directory and file name
Mc;MotionControl;4000_371;4000;371;End position of segment %1 lies in blocked joints area %2 with joint %3 (position %4) of kinematic %5;3;Error Minor;User error: The end position of a motion command is inside a blocked joints area;Robot and motion program are stopped;Change the motion program so that the end position is not in a blocked joints area;Segment name;Name of blocked joints area;Name of joint;Position of joint;Kinematic name
IoEcat;IoEtherCAT;6353_65573;6353;65573;%1: Init command '%2' failed during state transition '%3' (AL Status Code = 0x0025 Invalid output mapping).;3;Error Minor;An init command failed during a state transition of the EtherCAT slave. Output process data mapping does not match the expected mapping.;The operation of the EtherCAT segment is restricted. The operation of the effected EtherCAT slave is not possible.;Check the failed init command.;Configuration path or name of object;Init command;State transition
Rc;RobotControl;50_1480;50;1480;Several robots are inside shared area '%1';7;;Several robots are inside shared area;Program execution is not possible.;Move robots out of shared area.;Name of shared area
Rc;RobotControl;50_2559;50;2559;%2: PLC tracking update not running for tracking interface %1;8;;RCTR_ConvInterface is not enabled in PLC application;No tracking data from PLC;Activate tracking interface in PLC application;Number of used tracking interface;Name of robot
Io;IOSystem;2220_12035;2220;12035;%1: output side of cross-link '%2' already configured;3;Error Minor;A data sink for this cross-link has already been configured.;cross-link instance cannot be created.;Check configuration.;hardware configuration path;cross-link ID
TP3;TechnologyPLC3;56_22;56;22;Reading from file '%1' failed (%2, system error id %3);3;Error Minor;unknown;depending on context;unknown;name and path of the file;context;system error number
Io;IOSystem;2220_12041;2220;12041;%1: external clock synchronization finished;5;Info;Synchronization to external clock finished.;After successful synchronization system is clocked by an external clock signal.;-;Configuration path or name of device
Rc;RobotControl;50_1561;50;1561;%1: Error when disabling the drives of the NC channel (current mode/state: %2, error: %4) %3;7;;Error when disabling the drives of the NC channel.;Not all drives of the NC channel are disabled.;Check system and channel status.;Name of NC channel.;Current operating mode and status of the channel.;Program name / line number in enduser program where failure occured.;Error message from the command.
Rc;RobotControl;50_1430;50;1430;Parallelprogram '%1' could not be started %3;7;;--;--;--
Rc;RobotControl;50_2703;50;2703;Robot is in mold closure area! Automatic release of 'mold close enable' not given during change to manual main mode.;8;;--;--;--
Mc;MotionControl;4000_268;4000;268;Profile %1 (ID %2) contains invalid data;4;Warning;Application or user error: Invalid data have been submitted when calling McuCreateProfile(...).;Program will be stopped. Consecutive errors are possible.;Check application program or profile data in user program.;Name of dynamics profile;ID of dynamics profile
IoEcat;IoEtherCAT;6353_131098;6353;131098;%1: Transition to state '%2' (AL Status Code = 0x001A Synchronization error).;3;Error Minor;The EtherCAT slave has unexpectedly changed its state. Multiple synchronization errors. Slave is not synchronized any more.;The operation of the EtherCAT segment is restricted. The operation of the affected EtherCAT slave is not possible.;Identify reason for the state transition of the slave.;Configuration path or name of object;Current State
IoEcat;IoEtherCAT;6353_65575;6353;65575;%1: Init command '%2' failed during state transition '%3' (AL Status Code = 0x0027 Freerun not supported).;3;Error Minor;An init command failed during a state transition of the EtherCAT slave.;The operation of the EtherCAT segment is restricted. The operation of the effected EtherCAT slave is not possible.;Check the failed init command.;Configuration path or name of object;Init command;State transition
Mc;MotionControl;4000_207;4000;207;Path with ID %1 does not exist.;4;Warning;The desired path ID does not exist in the database (maybe the path has already been deleted).;Application error: An invalid path ID has been submitted.;Check the application program.;Path ID
Rc;RobotControl;50_3454;50;3454;%1: unable to start the mc interpolator for set values - at least on drive is in homing mode %3;9;;the mc interpolator for set-values cannot be started while drives are in homing mode;--;--;name of robot;programname/linenumber in enduserprogram where failure occured
Rc;RobotControl;50_1146;50;1146;%1: Unable to update dependent reference systems %3;7;;unable to update dependent reference systems;--;--;name of reference system;programname/linenumber in enduserprogram where failure occured
Rc;RobotControl;50_2388;50;2388;Program '%1' (id: %2) could not be added to flow-table, table is full;8;;program has been started but flow was not added to flow-table since this table is full - too many programs running;--;check running programs;name of program;flow-id of program
Rc;RobotControl;50_1785;50;1785;%1 : %2 instance has to be declared in the scope of a robot!;7;;The instance has been declared in the system scope.;This object can not been operated.;Move variable declaration into machine scope.;Full instance path of affected variable.;Datatype of affected variable. 
Io;IOSystem;2220_20;2220;20;%1: buffer overflow ('%2', '%3');4;Warning;An overflow occured on a system internal buffer.;Specific events get lost.;Contact distributor.;Hardware configuration path of object;More detailed description;More detailed description
KCmpL2R;CmpKLog2RepSys_V3;7512_14;7512;14;Download of projekt archive %1 succsessful;5;Info;-;-;-;Archive name
Mc;MotionControl;4000_713;4000;713;Invalid D1 in DH-parameters for Ecopaint transform;4;Warning;Internal error due to invalid DH-parameter.;Kinematic cannot be used. Motion program cannot be started.;Provide information to your distributor: Create a Status Report and e-mail it to your distributor.
TP3;TechnologyPLC3;56_6003;56;6003;Maximum number of NC axis per NC channel ('%1') exceeded.;6;Error Appl;The maximum number of NC axis per NC channel has been exceeded;-;-;Maximum number of NC axis per NC channel
SLx;StartupLinux;7246_13;7246;13;warmstart failed (%1);4;Warning;warmstart failed;-;-;errorcode
Rc;RobotControl;50_1902;50;1902;%1: Drive-error launched (errorcode: %3, additional data: %4, errorregister: %2);7;;--;--;--
IoEcat;IoEtherCAT;6353_65605;6353;65605;%1: Init command '%2' failed during state transition '%3' (AL Status Code = 0x0045 Mailbox SoE).;3;Error Minor;An init command failed during a state transition of the EtherCAT slave.;The operation of the EtherCAT segment is restricted. The operation of the effected EtherCAT slave is not possible.;Check the failed init command.;Configuration path or name of object;Init command;State transition
PciBus;Drv_PciBus;2115_122;2115;122;Internal error: EEPROM test of PCI device %1 function %2 failed.;3;Error Minor;test of PCI EEPROM failed;this is an internal error;contact supplier;PCI device number (slot);PCI function number
Xcrt;ExtCodeRt;6985_3;6985;3;%1: cannot load code file '%2';3;Error Minor;application code file cannot be loaded;application cannot run without code file;check configuration entry 'codeFile', check code file access permissions, check code file for unresolved external references;configured application name;name of application code file
Mc;MotionControl;4000_711;4000;711;Invalid turn (%1) in RobotTransform;4;Warning;An invalid turn occured.;Kinematic cannot be used. Motion program cannot be started.;Provide information to your distributor: Create a Status Report and e-mail it to your distributor.;Number of joint turns
IoEcat;IoEtherCAT;6353_65570;6353;65570;%1: Init command '%2' failed during state transition '%3' (AL Status Code = 0x0022 Slave needs PREOP).;3;Error Minor;An init command failed during a state transition of the EtherCAT slave. Slave application requires PREOP state;The operation of the EtherCAT segment is restricted. The operation of the effected EtherCAT slave is not possible.;Check the failed init command.;Configuration path or name of object;Init command;State transition
Xcrt;ExtCodeRt;6985_13;6985;13;%1: cannot attach function '%2' (number of attached functions at this hook exceeded);3;Error Minor;number of attached functions at this hook exceeded;cannot attach function;check configuration;name of hook;name of hookClientFunc
KCmpL2R;CmpKLog2RepSys_V3;7512_11;7512;11;Reset cold of application %1;5;Info;-;-;-;Applicationname
