objShortName;objFullName;msg_id;compNR;msgNR;msg_object;Message ClassID;Message ClassName;Reason;Effect;Solution;Parameter_1;Parameter_2;Parameter_3;Parameter_4;Parameter_5;Parameter_6;Parameter_7;Parameter_8;Parameter_9;Parameter_10;Parameter_11;Parameter_12;Parameter_13;Parameter_14;Parameter_15;Parameter_16
IoCan;IoCan;2242_9020;2242;9020;%1: LSS/LMT: Node-Id out of range;3;Error Minor;slave repels node-number;node-number not set;inform manufacturer;configured name or hardware configuration path of the module
Rc;RobotControl;50_1153;50;1153;Selecting a robot from within a triggeraction is not allowed %3;7;;--;--;--
IoCan;IoCan;2242_8290;2242;8290;%1: External Error. Error Code: %2;3;Error Minor;error at module; ; ;configured name or hardware configuration path of the module;errorcode of module
Tc;TeachControl;3700_257;3700;257;%1 (%2/%3): Stopping a called instance of routine '%4' was rejected;4;Warning;It was not possbile to stop routine with the STOP-statement because the routine was not started as a coroutine.;STOP statement had no effect.;Check the application.;Filename;Line;Column;Routinename
ShRtc;ShadowRtc;6050_3;6050;3;Cannot write to sync value to sram ;3;Error Minor; Can not write to sram;Sram data not up to date; 
IoEcat;IoEtherCAT;6353_52;6353;52;%1: Ethernet frame was received too late.;3;Error Minor;An Ethernet Frame was received too late, because either the EtherCAT segment is too big for the configured cycle time or the CPU power is not sufficient for the configured cycle time.;The operation of the EtherCAT segment is not possible.;Reduce the cycle time or the number of slaves in the EtherCAT segment, if the EtherCAT segment is very big. Use a more powerful CPU, if the EtherCAT segment is small.;Configuration path or name of object
Rc;RobotControl;50_2314;50;2314;%2: Invalid update type (%1) for special tracking %3;8;;invalid update type for special tracking;--;check update type for tracking;enumeration-id of update type;name of reference system;programname/linenumber in enduserprogram where failure occured
Mc;MotionControl;4000_767;4000;767;Inertia parameters for tool %1 are physically inconsistent (%2-direction);4;Warning;After transformation of inertia moments from the original coordinate system (cog) to the tool system (using parallel axis theorem) the resulting inertia moments are negative.;Calculated torques will not be physical.;Review the following parameters of the tool: mass, distanceCenterGravityX, distanceCenterGravityY, distanceCenterGravityZ, inertiaMomentJxx, inertiaMomentJyy, inertiaMomentJzz,  and inertiaMomentAroundCG;Tool name;Coordinate direction
Rc;RobotControl;50_1287;50;1287;%1: Program execution not possible due to missing operation release (active main mode: %2).;7;;Operation release was not granted to the robot.;Program execution is not possible.;Check operation release.;Name of robot.;Name of active main mode.
Mc;MotionControl;4000_9005;4000;9005;Matrix addition: not equally sized matrices;4;Warning;Internal message: Matrix calculation with matrices of different size.;Internal error with unspecific effect.;Provide information to your distributor: Create a Status Report and e-mail it to your distributor.
SysDgRep;SysDiagReport;7381_13;7381;13;Flashstate is critical.;4;Warning;Flashstate is critical.;Flash will get broken soon.;Change flash.
Rc;RobotControl;50_1291;50;1291;PLC-Interface not ready, stopping RC!;7;;The PLC-Interface did not get ready during bootup;--;Check setup
Rc;RobotControl;50_2394;50;2394;Drive %1: not ready for operation enable;8;;The drive can't be enabled, maybe because of a missing release-input;--;check drive and release-input;name of drive
Rc;RobotControl;50_148;50;148;%1: Fatal error in internal reference system administration %3;6;Error Appl;fatal error while updating Rc reference system list;--;--;name of reference system;programname/linenumber in enduserprogram where failure occured
Rc;RobotControl;50_2398;50;2398;%1: Drive %2 already in Standby-mode %3;8;;--;--;--
IoEcat;IoEtherCAT;6353_33;6353;33;%1: Ethernet frames were received successful again.;5;Info;After the loss of at least one Ethernet frame multiple Ethernet frames were received successful.;Data is available again.;No action is necessary.;Configuration path or name of object
IoCan;IoCan;2242_10005;2242;10005;%1: SDO (index: 0x%2 subindex: %3) aborted by server: 0x05040004 (CRC error (block mode only));3;Error Minor;SDO transfer has been aborted by SDO server (the CANOpen device).;SDO transfer failed.;Check the failed SDO transfer.;configured name or hardware configuration path of the module;SDO-Transfer index;SDO-Transfer Subindex
Tc;TeachControl;3700_73;3700;73;%1 (%2/%3): Invalid identifier: '%4';4;Warning;The given identifier can not be used at this position.;Application can not be compiled without errors.;Application must be corrected accordingly.;Filename;Line;Column;name of the identifier
ShRtc;ShadowRtc;6050_2;6050;2;Cannot write ShadowRtc to Eeprom ;3;Error Minor; Can not write data to eeprom;No actual data in eeprom; 
SysSm;SystemStateManager;6245_4;6245;4;Undefined system state %1;3;Error Minor;displayed systemstate is different to actual systemstate;no defined system state ; ;system state
Rc;RobotControl;50_1414;50;1414;%2: Definition of attribute-section-sizes (group %1 bit) is invalid %3;7;;--;--;--
Rc;RobotControl;50_1322;50;1322;Feedback signal '%1' for IO-output '%2' is not set.;7;;The feedback signal does not show the expected state.;The program is stopped.;Check equipment and application.;Name of feedback signal;Name of output
Rc;RobotControl;50_259;50;259;Drive %1 is not present in PLC-interface (robot: %2);6;Error Appl;Required software end-points for the drive are not available.;Drive can not be used.;Check configuration and application.;Name of drive.;Name of affected robot.
Mc;MotionControl;4000_444;4000;444;Kinematic <%1>: Drive position cannot be calculated from joint position for drive linkage (drive: %2 pos: %3).;4;Warning;For a non-linear drive the drive position cannot be determined from the joint position.;Robot will be stopped.;Modify robot program so that all poses are reachable.;Kinematic name;Drive number;Erroneous position
Rc;RobotControl;50_1903;50;1903;%1: Drive-error launched (no errorcode available);7;;--;--;--
Mc;MotionControl;4000_7004;4000;7004;Orientation not reachable;4;Warning;Error during manual movement: Robot cannot reach the orientation.;Robot and motion program are stopped.;Move robot to a different orientation.
Mc;MotionControl;4000_759;4000;759;Spring stiffness for joint %1 must not be negative;4;Warning;Spring stiffness for joint must not be negative.;Calculated torque model cannot be used.;Check the configuration of the torque model.;Joint name
IoCan;IoCan;2242_6051;2242;6051;%1: CAN-Open node address (%2) configured twice (%3);3;Error Minor;declared CAN-open node-address already in use; ;check config-files of IO-system;configured name or hardware configuration path of the module;Node address of the modul;HW-configurationpath of second object
IoEcat;IoEtherCAT;6353_35;6353;35;%1: %2: Node '%3' is inconsistent (section = '%4' / '%5').;3;Error Minor;Slaves with the same type (Vendor ID, Product Code) must define a consistent value or content for this node. The value or content of this node is not consistent for all slaves with the same type.;The operation of the EtherCAT segment is not possible.;Make value or content of this node consistent for all slaves with the same type.;Configuration path or name of object;Filename;Name of the inconsistent node;Section of node;Subsection of node
Mc;MotionControl;4000_9912;4000;9912;Release of non-existing write-lock. Object: %1 (ID %2);3;Error Minor;Error due to an internal problem in the system software.;Context sensitive. Look at additional messages.;Provide information to your distributor: Create a Status Report and e-mail it to your distributor.;Object name;Object ID
IoEcat;IoEtherCAT;6353_65568;6353;65568;%1: Init command '%2' failed during state transition '%3' (AL Status Code = 0x0020 Slave needs cold start).;3;Error Minor;An init command failed during a state transition of the EtherCAT slave. Slave device requires a power off - power on reset.;The operation of the EtherCAT segment is restricted. The operation of the effected EtherCAT slave is not possible.;Check the failed init command.;Configuration path or name of object;Init command;State transition
IoCan;IoCan;2242_9049;2242;9049;%1: CAN in Error Passive Mode (Error Register %2);3;Error Minor;see manual of device;see manual of device;see manual of device;configured name or hardware configuration path of the CAN-canal;error-register#
KCmpL2R;CmpKLog2RepSys_V3;7512_20;7512;20;Exception in %1;3;Error Minor;-;-;-;Componentname
TP3;TechnologyPLC3;56_5015;56;5015;'%1': Target Belt %2 Error (%3).;3;Error Minor;The Target Belt of the Infeed is in error state.;-;-;name of the Infeed;name of the belt;error ID of the Target Belt
Tc;TeachControl;3700_207;3700;207;%1 (%2/%3): No IEC-Event;3;Error Minor;The argument of SET_EVENT is not an IEC-event.;The program is interrupted.;Application must be corrected accordingly.;Filename;Line;Column
Rc;RobotControl;50_1226;50;1226;%1: Failed to fetch McuId for RefSys %3;7;;fetching the mcu-Id of the reference system failed;--;--;enum-id of reference system;programname/linenumber in enduserprogram where failure occured
Mc;MotionControl;4000_9973;4000;9973;Velocity of cartesian position exceeds limits even if stopped on path at %1;3;Error Minor;The cartesian velocity limit is exceeded even if stopped on path at the given path position. This happens due to tracking.;It is not possible to pass the given path position without exceeding the velocity limits.;Increase the velocity limit or reduce the tracking velocity.;segment position
SysDgRep;SysDiagReport;7381_14;7381;14;Remaining flash life time: %1%.;4;Warning;Flash is in use for too long a time.;Flash will get broken soon.;Change flash.;Remaining flash life time in percent.
Mc;MotionControl;4000_558;4000;558;Error-bit 8 has been set during inverse transformation;3;Error Minor;Reserved;Unspecific;None
Mc;MotionControl;4000_512;4000;512;"%8 Joint acceleration exceeds limit by %1 %%, base joint: %2; value: %3, limit: %4, motion command (%5) %6, parameter %7";3;Error Minor;A violation of the specified limit has been detected.;Message occurs, but program does not stop. Possible failure of the affected drive.;Reduce acceleration.;Excess in percent;Joint name;Current value;Violated limit;Position number of the segment in the path;Segment name;Segment parameter;Main run or in look-ahead problem
Mc;MotionControl;4000_191;4000;191;Cannot read line %2 in motion file %1.;3;Error Minor;User error: Cannot read specified line in a motion file.;Cannot execute motion command.;Check the specified line of the file.;file name;line number
TP3;TechnologyPLC3;56_2310;56;2310;%1': minimum software position limit of drive (%3 (%4)) is more restrictive than in PLC (%2);4;Warning;The minimum (negative) software position limit of the drive is less than negative software position limit of PLC.;-;The parameter for the software position limits of the axis and of the drive have to be checked.;name of the axis;configured limit of control;configured limit of drive [units of control];configured limit of drive [units of drive]  
IoEcat;IoEtherCAT;6353_131106;6353;131106;%1: Transition to state '%2' (AL Status Code = 0x0022 Slave needs PREOP).;3;Error Minor;The EtherCAT slave has unexpectedly changed its state. Slave application requires PREOP state;The operation of the EtherCAT segment is restricted. The operation of the affected EtherCAT slave is not possible.;Identify reason for the state transition of the slave.;Configuration path or name of object;Current State
TP3;TechnologyPLC3;56_1411;56;1411;%1': configuration parameter '%2' is invalid (%3, %4);3;Error Minor;The value of a configuration parameter is invalid.;unknown;-;name of the object (axis);name of the parameter;detailed description  ;detailed description
Rc;RobotControl;50_2389;50;2389;Program '%1' (id: %2) could not be registered as parallel flow of flow %3, table is full;8;;parallel program has been started but flow was not added to flow-table, since this table is full - too many programs running;--;check running programs;name of program;flow-id of program;flow-id of program which has started this flow
IoCan;IoCan;2242_350;2242;350;%1: short circuit/earth leakage. Error Code: %2;3;Error Minor;short circuit emergency reported by CANOpen-drive DS402; ; ;configured name or hardware configuration path of the axis;errorcode of module
SysDgRep;SysDiagReport;7381_3;7381;3;Detected fan device %1 is ok;5;Info; ; ; ;device id
IoEcat;IoEtherCAT;6353_131122;6353;131122;%1: Transition to state '%2' (AL Status Code = 0x0032 PLL error).;3;Error Minor;The EtherCAT slave has unexpectedly changed its state. Master not synchronized, at least one DC event received.;The operation of the EtherCAT segment is restricted. The operation of the affected EtherCAT slave is not possible.;Identify reason for the state transition of the slave.;Configuration path or name of object;Current State
Mc;MotionControl;4000_577;4000;577;Kinematik %2%1 shows numerical problems in dynamic calculation at %3;3;Error Minor;The kinematic cannot perform the programmed movement.;Robot and motion program are stopped.;Modify path of robot in the motion program.;Error context;Kinematic name;Location
Rc;RobotControl;50_2930;50;2930;Enable MoveByHand not allowed in this operation mode;8;;jogEnable variable is FALSE;MoveByHand can't be enabled;Switch to ManualMode or reconfigure jogEnable variable
Mc;MotionControl;4000_394;4000;394;The tool chain of tool %1 contains guard points between two moving tools;8;;Application error: the tool contains an invalid combination of guard points and moving tools.;The tool cannot be used.;Check and correct the tool data in the application program.;Tool name
Mc;MotionControl;4000_719;4000;719;Invalid Alpha34 in DH-parameters for Ecopaint transform;4;Warning;Internal error due to invalid DH-parameter.;Kinematic cannot be used. Motion program cannot be started.;Provide information to your distributor: Create a Status Report and e-mail it to your distributor.
Rc;RobotControl;50_2327;50;2327;A safety door is open - Enabling drives for '%1' not possible;8;;A safety door is open;Enabling drives not possible;check equipment;name of robot
IoCan;IoCan;2242_10001;2242;10001;%1: SDO (index: 0x%2 subindex: %3) aborted by server: 0x05040000 (SDO protocol timeout);3;Error Minor;SDO transfer has been aborted by SDO server (the CANOpen device).;SDO transfer failed.;Check the failed SDO transfer.;configured name or hardware configuration path of the module;SDO-Transfer index;SDO-Transfer Subindex
Rc;RobotControl;50_2364;50;2364;Program to start/continue can't be identified, since several programs are active;8;;the system was unable to identify the program which should be started/continued;--;select a program to start/continue
Rc;RobotControl;50_3471;50;3471;Missing or invalid configuration for '%1' - default value %2 is used;9;;A configuration entry is either missing or invalid, thus a default value is used;System might not operate as exptected;Adjust configuration;Name of the configuration entry;Default value for this configuration entry
Rc;RobotControl;50_3701;50;3701;%1: Backward movement completed (movement time forward: %2ms, distance traveled: %3mm) ;9;;The backward movement was successfully completed;The backward movement was successfully completed;-;Name of robot;Duration of the backward movement (time required by the corresponding path section during the forward movement);Distance travelled during backward movement
TP3;TechnologyPLC3;56_20;56;20;Open file '%1' failed (%2, mode %3, system error id %4);3;Error Minor;Possible Reasons: Missing access rights or not existing path/file.;depending on context;Check access rights and path.;name and path of the file;context;open mode;system error number
TP3;TechnologyPLC3;56_2012;56;2012;%1': timeout writing mode of operation (%2, %3, %4);3;Error Minor;A timeout expired, while changing the mode of operation.;The operating mode has not been changed.;-;name of the axis;actual mode of operation;target mode of operation;timeout
CatRet;CatalogRetain;2218_114;2218;114;invalid fileheader in retainFile, cause %1;3;Error Minor;invalid fileheader ; ; ;element name
IoCan;IoCan;2242_4018;2242;4018;%1: Recover from bus off;5;Info;no more errors after Bus-Off and recover; ; ;Hardware configuration path or name of the CAN-channel
Xcrt;ExtCodeRt;6985_10;6985;10;%1: execution aborted, caused by invalid IO value;3;Error Minor;application execution aborted;application code is not executed;check application code for generation of invalid IO values;configured application name
PciBus;Drv_PciBus;2115_121;2115;121;Internal error: Disabling write access for EEPROM number %1 failed.;3;Error Minor;disabling write access lock has failed;this is an internal error;contact supplier;number of EEPROM
IoCan;IoCan;2242_6102;2242;6102;%1: SDO (index: 0x%2 subindex: %3) receive buffer size too small (expected size: %4);3;Error Minor;length of data higher than receive-buffer; ; ;configured name or hardware configuration path of the module;SDO-Transfer index;SDO-Transfer Subindex;Expected Size of Buffer
Rc;RobotControl;50_3451;50;3451;%1 activated %3;9;;the robot has been activated;--;--;name of robot;programname/linenumber in enduserprogram where failure occured
Rc;RobotControl;50_1710;50;1710;%2: Providing 'triggeredPos' is mandatory for '%1' if robot does not stop at signal %3;7;;A necessary parameter was not specified.;Function cannot be executed.;Correct function call.;Name of macro;Affected robot;Program name/line number in end-user program where failure occured
TP3;TechnologyPLC3;56_1020;56;1020;'%1': Stop Category 2 not supported. Performing Stop Category 1.;5;Info;The drive doesn't support Stop Category 2. Stop Category 1 is applied instead.;A Stop Category 1 stop is performed instead of Stop Category 2.;Use Stop Category 1.;name of the axis
Tc;TeachControl;3700_135;3700;135;%1 (%2/%3): Invalid jump;4;Warning;Jumps into statement-blocks are forbidden.;Application can not be compiled without errors.;Application must be corrected accordingly.;Filename;Line;Column
Mc;MotionControl;4000_704;4000;704;Invalid link numbers in RobotTransform;4;Warning;Error due to an internal problem in the system software.;Kinematic not available. MCU cannot be started.;Provide information to your distributor: Create a Status Report and e-mail it to your distributor.
Rc;RobotControl;50_1286;50;1286;%1: Program execution not possible due to a missing safety release (active main mode: %2).;7;;Safety release was not granted to the robot.;Program execution is not possible.;Check safety release.;Name of robot.;Name of active main mode.
Rc;RobotControl;50_1199;50;1199;Drive %1 has lost its reference;7;;A previously referenced drive is not referenced any more;--;Reference drive;name of drive
Mc;MotionControl;4000_170;4000;170;"Setting kinematic <%5> on path <%4> with wrong mode (%2); path position needs mode %3 - <%1>.";3;Error Minor;Error in application program.;Motion program and robot are stopped.;Check the application program.;Look-ahead or main run;Robot mode;Mode of path position;Path name;Kinematic name
Io;IOSystem;2220_208;2220;208;%1: sensor failure cleared line %2;5;Info;A sensor failure is cleared, connection to the sensor is established.;Sensor value is processed and transfered to system endpoints.;-;Configuration path or name of input;Line (0, A, B)
TP3;TechnologyPLC3;56_1106;56;1106;%1: drive lost reference;3;Error Minor;The drive of the axis lost its reference.;The axis is not referenced any more.;A homing sequence has to be performed on the axis.;name of the axis  
Io;IOSystem;2220_12048;2220;12048;%1: Endpoint inactive;3;Error Minor;The endpoint is inactive because it is not useable in the current constellation;The endpoint error state is set to 1;Remove endpoint from configuration or use another device for which this endpoint is available.;Configuration path or name of endpoint
Rc;RobotControl;50_1491;50;1491;%1: '%2' failed - Velocity limited guards are not available for the robot %3;7;;Dynamic monitoring for guards is not available (configured) for this robot.;Function could not be executed.;Enable dynamic monitoring for guards.;Name of robot.;Name of function.;Program name/line number in enduser program where failure occured.
Rc;RobotControl;50_2802;50;2802;%1.%2: The provided reference system does not use this tracking object %3;8;;The tracking object is not in the reference system chain of the provided system;Position check is not possible;Check parameters of function call;Name of affected object;Function in which failure occured;Program name/line number in end-user program where problem occured
Rc;RobotControl;50_2374;50;2374;%1: Given homingmode (%2) is not supported for simulated drives - using actual position as reference %3;8;;Homing mode for simulated drives not supported;--;--;name of drive;homing mode;name of homing mode
IoCan;IoCan;2242_10007;2242;10007;%1: SDO (index: 0x%2 subindex: %3) aborted by server: 0x06010000 (Unsupported access to an object);3;Error Minor;SDO transfer has been aborted by SDO server (the CANOpen device).;SDO transfer failed.;Check the failed SDO transfer.;configured name or hardware configuration path of the module;SDO-Transfer index;SDO-Transfer Subindex
Mc;MotionControl;4000_781;4000;781;Configured number of additional robot positions (%1) too big for this robot type (may be at most %2).;3;Error Minor;Configuration error: the configured number of additional robot positions is too big,;Kinematic cannot be used. Motion program cannot be started.;Check the configuration data of the kinematic.;Configured number of additional robot positions;At most allowed number of additional robot positions
TP3;TechnologyPLC3;56_5032;56;5032;'%1': Command ResetError on Belt '%2' failed (%3).;3;Error Minor;The command MC_ResetError failed.;The belt is not operable.;-;name of the infeed;index/name of the belt/axis;Error ID of the command 
Tc;TeachControl;3700_291;3700;291;Variable changed (part %1) old value: %2;5;Info;A variable has been changed externally.;n.a.;n.a.;message part;old value
Rc;RobotControl;50_2591;50;2591;%1: Unload program not possible, status = %2;8;;Program requested by RC interface failed to unload.;Program still in memory.;Check all necessary conditions.;Name of interface instance.;Status of requested program.
PciBus;Drv_PciBus;2115_124;2115;124;Internal error: Invalid device definition array.;3;Error Minor;invalid device definition;this is an internal error;contact supplier
Rc;RobotControl;50_1872;50;1872;%1: failed to activate '%2' since '%4' is still active. %3;7;;Another guiding frame is still active for this robot.;Activation of the new guiding frame failed.;Deactivate already active guiding frame first.;Name of Robot;Name of affected guiding frame;Programname/linenumber in enduserprogram where failure occured;Name of already active guiding frame
Rc;RobotControl;50_1554;50;1554;%1: Request to switch back to Automatic mode after executing <%2> has failed %3;7;;Program cannot be continued.;Requested command is not executed as expected.;Check system state (releases, drive state, pending errors, ...).;Name of robot.;KAIRO command.;Program name / line number in enduser program where failure occured.
Rc;RobotControl;50_2328;50;2328;The main-mode manager is not ready - Enabling drives for '%1' not possible;8;;The main-mode manager is not ready;Enabling drives not possible;check equipment;name of robot
Tc;TeachControl;3700_44;3700;44;%1 (%2/%3): No type;4;Warning;The given expression has no type.;Application can not be compiled without errors.;Application must be corrected accordingly.;Filename;Line;Column
Mc;MotionControl;4000_160;4000;160;Invalid position %1 in motion command %2 (ID %3).;3;Error Minor;Application error. Segment with invalid position was defined.;Robot and motion program are stopped.;Check the application program.;Number of the position in the segment (1,2,3);Segment name;Segment ID
IoCan;IoCan;2242_6100;2242;6100;%1: SDO (index: 0x%2 subindex: %3) confirmation timeout (%4 ms);3;Error Minor;no answer at SDO-transfer; ; ;configured name or hardware configuration path of the module;SDO-Transfer index;SDO-Transfer Subindex;Timeout time in ms
Mc;MotionControl;4000_174;4000;174;%5: Mode (%3) of start position <%7> of %6segment <%4> differs in flag <%8> from target mode (%2) of previous segment (<%1>).;3;Error Minor;Internal error: mismatch of modes at the endo f the previous and the start of the new motion.;Motion program and robot are stopped.;Provide information to your distributor: Create a Status Report and e-mail it to your distributor.;Source of defect (Look-ahead or main run);Target mode of last segment;Calculated start mode;Segment name;Kinematic name;Interpolation type;Name of target position;Name of problematic mode flag
Rc;RobotControl;50_1151;50;1151;Homing offset for '%1' out of range %3;7;;Invalid offset;--;check homing parameters;name of drive;programname/linenumber in enduserprogram where failure occured
Io;IOSystem;2220_202;2220;202;%1: invalid calibrate data ('%2');3;Error Minor;The eeprom of specified device contains invalid calibration data.;-;-;Configuration path or name of object;More detailed error description
Mc;MotionControl;4000_9000;4000;9000;Bad size in matrix constructor;4;Warning;Internal message: Matrix with negative number of lines or columns;Internal error with unspecific effect.;Provide information to your distributor: Create a Status Report and e-mail it to your distributor.
